category,difficulty,questionType,questionText,answerText,option1,option2,option3,option4,correctOption,explanation,mediaUrl,tags,mainGame,everyoneAnswers,buzzerMode,timeLimit
الرياضة,easy,text,كم عدد لاعبي فريق كرة السلة؟,5,5,7,9,11,1,كل فريق يتكون من 5 لاعبين في الملعب,,شائع,TRUE,TRUE,TRUE,20
التاريخ,medium,text,من بنى أول سفينة في التاريخ حسب القرآن؟,نوح عليه السلام,إبراهيم عليه السلام,نوح عليه السلام,موسى عليه السلام,سليمان عليه السلام,2,ذُكرت قصة سفينة نوح في سورة هود,,عربي,TRUE,TRUE,FALSE,30
الجغرافيا,easy,text,ما هي أكبر دولة عربية مساحةً؟,الجزائر,السعودية,الجزائر,مصر,السودان,2,تبلغ مساحة الجزائر 2.38 مليون كم²,,عربي|شائع,TRUE,TRUE,TRUE,20
العلوم,medium,text,ما هو أقرب كوكب للشمس؟,عطارد,الزهرة,عطارد,المريخ,الأرض,2,عطارد يبعد عن الشمس حوالي 58 مليون كم,,عالمي,TRUE,TRUE,TRUE,20
العلوم,hard,text,ما هو العنصر الأكثر وفرة في الكون؟,الهيدروجين,الأكسجين,الهيليوم,الهيدروجين,الكربون,3,يشكل الهيدروجين حوالي 75% من المادة في الكون,,عالمي,TRUE,TRUE,FALSE,30
الفن والثقافة,medium,image,من رسم هذه اللوحة الشهيرة؟,ليوناردو دافنشي,بيكاسو,فان جوخ,ليوناردو دافنشي,مايكل أنجلو,3,لوحة الموناليزا رُسمت بين 1503-1519,https://example.com/monalisa.jpg,عالمي,TRUE,TRUE,FALSE,30
